{
  "$schema": "https://json-schema.org/draft/2020-12/schema",
  "$id": "urn:agentskills:security-scan:findings",
  "title": "Security scan findings",
  "type": "object",
  "required": ["documentType", "schemaVersion", "scanId", "findings"],
  "properties": {
    "documentType": {
      "const": "security-scan.findings"
    },
    "schemaVersion": {
      "const": "1.0"
    },
    "scanId": {
      "type": "string",
      "minLength": 1
    },
    "findings": {
      "type": "array",
      "items": {
        "type": "object",
        "required": [
          "findingId",
          "occurrenceId",
          "ruleId",
          "identity",
          "fingerprints",
          "title",
          "summary",
          "severity",
          "confidence",
          "taxonomy",
          "locations",
          "remediation",
          "provenance"
        ],
        "properties": {
          "findingId": {
            "type": "string",
            "pattern": "^csf_[a-f0-9]{24}$"
          },
          "occurrenceId": {
            "type": "string",
            "pattern": "^occ_[a-f0-9]{24}$"
          },
          "ruleId": {
            "type": "string",
            "pattern": "^[a-z0-9][a-z0-9._/-]*$"
          },
          "identity": {
            "type": "object",
            "required": ["anchor"],
            "properties": {
              "anchor": {
                "type": "string",
                "pattern": "^[a-z0-9][a-z0-9._/-]*$"
              },
              "instance": {
                "type": "string",
                "pattern": "^[a-z0-9][a-z0-9._/-]*$"
              }
            }
          },
          "fingerprints": {
            "type": "object",
            "required": ["algorithm", "primary"],
            "properties": {
              "algorithm": {
                "const": "security-scan/v1"
              },
              "primary": {
                "type": "string",
                "pattern": "^security-scan/v1:sha256:[a-f0-9]{64}$"
              }
            }
          },
          "title": {
            "type": "string",
            "minLength": 1
          },
          "summary": {
            "type": "string",
            "minLength": 1
          },
          "severity": {
            "type": "object",
            "required": ["level"],
            "properties": {
              "level": {
                "enum": ["critical", "high", "medium", "low", "informational"]
              },
              "score": {
                "type": "number",
                "minimum": 0,
                "maximum": 10
              },
              "scoringSystem": {
                "type": "string",
                "minLength": 1
              },
              "vector": {
                "type": "string",
                "minLength": 1
              },
              "rationale": {
                "type": "string",
                "minLength": 1
              },
              "changeConditions": {
                "type": "string",
                "minLength": 1
              }
            }
          },
          "confidence": {
            "type": "object",
            "required": ["level", "rationale"],
            "properties": {
              "level": {
                "enum": ["high", "medium", "low"]
              },
              "rationale": {
                "type": "string",
                "minLength": 1
              }
            }
          },
          "taxonomy": {
            "type": "object",
            "required": ["category", "cwe"],
            "properties": {
              "category": {
                "type": "string",
                "minLength": 1
              },
              "cwe": {
                "type": "array",
                "items": {
                  "type": "string",
                  "minLength": 1
                }
              }
            }
          },
          "locations": {
            "type": "array",
            "minItems": 1,
            "items": {
              "type": "object",
              "required": ["path", "startLine"],
              "properties": {
                "path": {
                  "type": "string",
                  "minLength": 1
                },
                "startLine": {
                  "type": "integer",
                  "minimum": 1
                },
                "endLine": {
                  "type": "integer",
                  "minimum": 1
                },
                "role": {
                  "type": "string",
                  "minLength": 1
                }
              }
            }
          },
          "codeEvidence": {
            "type": "array",
            "items": {
              "type": "object",
              "required": ["id", "label", "path", "startLine", "code", "explanation"],
              "properties": {
                "id": {
                  "type": "string",
                  "pattern": "^[a-z0-9][a-z0-9._/-]*$"
                },
                "label": {
                  "type": "string",
                  "minLength": 1
                },
                "path": {
                  "type": "string",
                  "minLength": 1
                },
                "startLine": {
                  "type": "integer",
                  "minimum": 1
                },
                "endLine": {
                  "type": "integer",
                  "minimum": 1
                },
                "language": {
                  "type": "string",
                  "minLength": 1
                },
                "code": {
                  "type": "string",
                  "minLength": 1
                },
                "explanation": {
                  "type": "string",
                  "minLength": 1
                }
              }
            }
          },
          "rootCause": {
            "type": ["object", "string"],
            "required": ["summary"],
            "properties": {
              "summary": {
                "type": "string",
                "minLength": 1
              },
              "evidenceRefs": {
                "type": "array",
                "items": {
                  "type": "string",
                  "minLength": 1
                }
              },
              "code": {
                "type": "string",
                "minLength": 1
              },
              "language": {
                "type": "string",
                "minLength": 1
              }
            }
          },
          "remediation": {
            "type": "string",
            "minLength": 1
          },
          "validation": {
            "type": ["object", "null"]
          },
          "attackPath": {
            "type": ["object", "null"]
          },
          "remediationTests": {
            "type": "array",
            "items": {
              "type": "string",
              "minLength": 1
            }
          },
          "preventiveControls": {
            "type": "array",
            "items": {
              "type": "string",
              "minLength": 1
            }
          },
          "provenance": {
            "type": "object",
            "required": ["source"],
            "properties": {
              "source": {
                "type": "string",
                "minLength": 1
              }
            }
          },
          "extensions": {
            "type": "object"
          }
        }
      }
    }
  }
}
